සයනාසනයට වඩින්න​,කරුණාරත්න අබේසේකර​,1980,අමරඟනෙනි පිය මැන එන අඳුර උනන අවරගිරින්,No,0,,,
සයනාසනයට වඩින්න​,කරුණාරත්න අබේසේකර​,1980,ඇතුළු වන්න ආත්මයට මගේ නයන කවුළු දොරින්,Yes,1,නයන කවුළු දොරින්,Eyes,Window
සුවඳ සිහින පොදි,කරුණාරත්න අබේසේකර​,1979,දැණුනා සැඟවෙමින් සැතපුණු මහගු සෙනේ,No,0,,,
සුවඳ සිහින පොදි,කරුණාරත්න අබේසේකර​,1979,සත්සර ගොළු වුනා මා හද කණක වෙණේ,Yes,1,හද කණක වෙණේ,Heart,The harp
සුවඳ සිහින පොදි,කරුණාරත්න අබේසේකර​,1979,මගෙ හද තඹර සතු බඹරිඳු මිහිරිතම​,Yes,1,හද තඹර,Heart,Lotus
සුවඳ සිහින පොදි,කරුණාරත්න අබේසේකර​,1979,ඇත ඔබෙ සුවඳ පැල තුළ හැම අඟලකම​,No,0,,,
සුවඳ සිහින පොදි,කරුණාරත්න අබේසේකර​,1979,ඔබ යළි පැමිණි පසු බිමලා හුඟක් බර​,No,0,,,
සුවඳ සිහින පොදි,කරුණාරත්න අබේසේකර​,1979,මම මුළුමණින් හැර අඬවන් මනස් දොර​,Yes,1,මනස් දොර​,Mind,Door
වශී,කරුණාරත්න අබේසේකර​,1982,පසුගිය දිනෙක එළිපිට නොබියව දෙන්නා,No,0,,,
වශී,කරුණාරත්න අබේසේකර​,1982,පිළිසඳරෙක උනිමු මගෙ හද ගැබ පෙන්නා,Yes,1,හද ගැබ,Heart,Sky
වශී,කරුණාරත්න අබේසේකර​,1982,ඔබ ගෙන ගියත් මම ආවෙමි ඔබව හඹා,No,0,,,
වශී,කරුණාරත්න අබේසේකර​,1982,නැත හැකිළුණේ සනහස් සොමි කිරණ පබා,Yes,1,සනහස් සොමි කිරණ,Love,Moonlight
අපි ඉඳිමු පුතේ,කරුණාරත්න අබේසේකර​,1970,මා ඔබ හෙට ඔවුන් වෙනුවෙන් පිදුව වග​,No,0,,,
අපි ඉඳිමු පුතේ,කරුණාරත්න අබේසේකර​,1970,කිවමැන පුතේ අමතා එන සෙනඟ ග​ඟ,Yes,1,සෙනඟ ග​ඟ,Crowd,River
ප්‍රජාපතියගේ නැළවිලි ගීතය​,කරුණාරත්න අබේසේකර​,1983,නාමල් සුව බර සිනිඳු සුමුදු යස පුළුල් උකුල් සයනේ,Yes,1,උකුල් සයනේ,Lap,Bed
ප්‍රජාපතියගේ නැළවිලි ගීතය​,කරුණාරත්න අබේසේකර​,1983,ඈත හිමවු කුල හිමි වන්දන තුරු සිප එන මද පවනේ,No,0,,,
ප්‍රජාපතියගේ නැළවිලි ගීතය​,කරුණාරත්න අබේසේකර​,1983,බව ඝන තිමිරෙන් එළිය දකින්නත බිඳ බිය ජනක බැමී,Yes,1,බව ඝන තිමිරෙන්,Life,Thick layer of dust
ප්‍රජාපතියගේ නැළවිලි ගීතය​,කරුණාරත්න අබේසේකර​,1983,ඔබ යන ගමනෙදි නිරතුරු දිරි වෙර දීමත සපථ වෙමී,No,0,,,
ඔබේ හදවත තරම් ලස්සන තැනක්,කරුණාරත්න අබේසේකර​,1981,හිමවත සඳුන් වනයෙහි මුදු සිසිල පිඹ​,No,0,,,
ඔබේ හදවත තරම් ලස්සන තැනක්,කරුණාරත්න අබේසේකර​,1981,දුක් ගිනි නිවාලන පිනිදිය ගඟකි ඔබ​,Yes,1,ගඟකි ඔබ​,You,River
මදුරතම වින්දන​,කරුණාරත්න අබේසේකර​,1982,ඉඳු දද දහක් දිවි අඹරෙහි පහළවන​,Yes,1,දිවි අඹරෙහි,Life,Sky
මදුරතම වින්දන​,කරුණාරත්න අබේසේකර​,1982,මගෙ කල්පනා මල් පුබුදා සුවඳ දෙන​,Yes,1,කල්පනා මල්,Thoughts,Flowers
රූපවාහිනියේ,කරුණාරත්න අබේසේකර​,1982,බුදු දහමයි ජීව නාළිය හෙළ දූවේ,Yes,1,බුදු දහමයි ජීව නාළිය,Buddhism,Life
රූපවාහිනියේ,කරුණාරත්න අබේසේකර​,1982,එය ඔබෙ පිළිසරණ ලැබ පණ ගැහුනාවේ,No,0,,,
දොඩමළු ගිරවුනි,කරුණාරත්න අබේසේකර​,1979,ඔබ හද පුදසුනෙහි පෙම් මල් පිදුව අත​,Yes,1,හද පුදසුනෙහි,Heat,The altar
දොඩමළු ගිරවුනි,කරුණාරත්න අබේසේකර​,1979,ඔබෙ නෙත් කඳුළෙන්ම සෝදන ගතිය කැත​,No,0,,,
තවත් නෑයෙක්,කරුණාරත්න අබේසේකර​,1983,ගිලි ගිලී නැහැවී හද සෙනඟ ගගේ,Yes,1,සෙනඟ ගගේ,Crowd,River
තවත් නෑයෙක්,කරුණාරත්න අබේසේකර​,1983,ගත කළ එකම වහලක් යත තුරුණු යුගේ,No,0,,,
තවත් නෑයෙක්,කරුණාරත්න අබේසේකර​,1983,හද ගඟ ඉතිරී යන සහසක් රළ පතර​,Yes,1,හද ගඟ,Heart,River
තවත් නෑයෙක්,කරුණාරත්න අබේසේකර​,1983,සෙසු සොයුරන් දෙසත් නෙත් හරවන නිතර​,No,0,,,
තවත් නෑයෙක්,කරුණාරත්න අබේසේකර​,1983,මිදුලට එන විටදි ඔබගේ සුවඳ වැදී,No,0,,,
තවත් නෑයෙක්,කරුණාරත්න අබේසේකර​,1983,මගෙ හද මලට සිතිවිලි වන බඹරු විදී,Yes,1,හද මලට,Hear,Flower
තවත් නෑයෙක්,කරුණාරත්න අබේසේකර​,1983,මගෙ හද මලට සිතිවිලි වන බඹරු විදී,Yes,1,සිතිවිලි වන බඹරු,Thoughts,Wild wasp
තවත් නෑයෙක්,කරුණාරත්න අබේසේකර​,1983,මගෙ ජීවන අඹර තලයේ මෙයින් මතූ,Yes,1,ජීවන අඹර තලයේ,Life,Sky
තවත් නෑයෙක්,කරුණාරත්න අබේසේකර​,1983,ඉර හඳ වගේ ඔව දෙදෙනා සිටිය යුතූ,No,0,,,
මහලු නොවන් සොඳුරේ,කරුණාරත්න අබේසේකර​,1982,නෑ කැළ වස්තුව වංශය නොබලා,No,0,,,
මහලු නොවන් සොඳුරේ,කරුණාරත්න අබේසේකර​,1982,ආදර පුදසුන මත හද තබලා,Yes,1,ආදර පුදසුන,Love,The altar
සුබා,කරුණාරත්න අබේසේකර​,1980,හද නිම්නයේ නොමැකෙන සිහිවටන තබා,Yes,1,හද නිම්නයේ,Hear,Valley
සුබා,කරුණාරත්න අබේසේකර​,1980,අකලට පරවු මල මෙන් මළ නමුදු සුබා,No,0,,,
සුබා,කරුණාරත්න අබේසේකර​,1980,ඔබෙ පැහැදිළි නුවන් නිල්මිණි විහිදු පබා,Yes,1,නුවන් නිල්මිණි,Eyes,Blue gems
සුබා,කරුණාරත්න අබේසේකර​,1980,ඇත මගෙ මනස්කුටියේ එක් කොනක ඔබා,No,0,,,
යළිත් මධු සමයට​,කරුණාරත්න අබේසේකර​,1983,පෙර අත් බවවලත් සනහස් කිරුළ රැක​,Yes,1,සනහස් කිරුළ,Love,Crown
යළිත් මධු සමයට​,කරුණාරත්න අබේසේකර​,1983,අප පෙම්වතුන් වී ඉන්ටැ'ති නොමැත සැක​,No,0,,,